{
  "version": "persona-quiz-v2",
  "built": "2026-09-26",
  "sources": [
    "../library/types.json",
    "../library/tags.json"
  ],
  "axes": [
    {
      "id": "R1",
      "plus": "We",
      "minus": "Me",
      "zhPlus": "我們",
      "zhMinus": "我",
      "plusLine": "Your people are your happy place. Close means shared: plans, snacks, calendars.",
      "minusLine": "You love hard and keep your own door. Close still means space.",
      "h": {
        "plusLine": "You feel most yourself when life is shared with the people close to you.",
        "minusLine": "You love deeply and keep room of your own. For you, closeness includes space.",
        "plusKnow": "You show love by sharing life. The same plans, the same table, a spare key.",
        "minusKnow": "You can miss someone and still need an evening alone. That time is how you come back whole.",
        "flexKnow": "You choose closeness person by person. Some get everything, some get a little room.",
        "sheet": {
          "plus": {
            "light": "You enjoy sharing the big moments and you're comfortable alone for the rest.",
            "clear": "Plans feel better to you when your people are part of them.",
            "strong": "You're the one who gathers people. Life feels most yours when shared."
          },
          "minus": {
            "light": "You love your people, and you keep a little time that's only yours.",
            "clear": "Time alone is how you recharge, and your people get the best of you after.",
            "strong": "Your own company restores you. A quiet night alone is a gift."
          },
          "both": "Some days you want your people close, some days your own space. Both are you."
        }
      },
      "topic": "How close you keep people",
      "plusKnow": "You love in logistics. Shared calendars, the spare key, the group order: close means together.",
      "minusKnow": "You can miss someone and still want the night alone. That's how you come back full.",
      "flexKnow": "Some people get the spare key, some get a warm wave. You choose person by person.",
      "plusKeyword": "Loyal",
      "minusKeyword": "Independent",
      "sheet": {
        "plus": {
          "light": "You like company for the big stuff and fly solo for the rest.",
          "clear": "Plans get better when your people are in them, so you make sure they are.",
          "strong": "If there's a group plan, you started it. If there isn't, you're starting one."
        },
        "minus": {
          "light": "You love your people and still guard a night or two for yourself.",
          "clear": "You recharge alone and come back better. Your people get the good version.",
          "strong": "Your own company is a top-tier plan. A cancelled plan feels like a gift."
        },
        "both": "Crowd or quiet, you pick by the day, and both feel like you."
      }
    },
    {
      "id": "R2",
      "plus": "Direct",
      "minus": "Soft",
      "zhPlus": "直",
      "zhMinus": "柔",
      "plusLine": "You say the hard thing to their face, because that's how you show respect.",
      "minusLine": "You hold the person first. The hard part waits for a gentler moment.",
      "h": {
        "plusLine": "You say difficult things directly, because to you that is a form of respect.",
        "minusLine": "You look after the person first and choose a gentle moment for the hard part.",
        "plusKnow": "You name hard things early so no one gets hurt later. It comes from care.",
        "minusKnow": "You can bring hard news so gently that people feel held. Few people can.",
        "flexKnow": "You choose your words by who's in front of you. Gentle with some, plain with others.",
        "sheet": {
          "plus": {
            "light": "You'll name a hard thing when it matters, and you choose which ones.",
            "clear": "You'd rather have one honest conversation than let hints pile up.",
            "strong": "Asked what you think, you answer plainly, out of respect."
          },
          "minus": {
            "light": "You tell the truth, and you take a moment to soften it first.",
            "clear": "You choose the moment and the words so the truth can be heard gently.",
            "strong": "You deliver hard news so kindly that people feel cared for, not judged."
          },
          "both": "You're plain with some people and gentle with others, as they need."
        }
      },
      "topic": "How you say hard truths",
      "plusKnow": "You say the hard thing early so nobody walks into a wall later. Blunt, yes. Also care.",
      "minusKnow": "You can deliver bad news so gently that people thank you for it. Most people never learn that.",
      "flexKnow": "Soft with some people, straight with others. You pick the tone for the person.",
      "plusKeyword": "Speaks plainly",
      "minusKeyword": "Kind with words",
      "sheet": {
        "plus": {
          "light": "You'll say the hard thing when it matters, just not every time.",
          "clear": "You'd rather have one awkward talk than a month of hints.",
          "strong": "Ask for your opinion and you'll get it, straight, no garnish."
        },
        "minus": {
          "light": "You tell the truth, you just sand the edges first.",
          "clear": "You pick your moment and your words, so the truth lands softly.",
          "strong": "You could tell someone their idea is bad and they'd thank you."
        },
        "both": "Blunt with some, gentle with others. You read who can take it."
      }
    },
    {
      "id": "R3",
      "plus": "Classic",
      "minus": "Own",
      "zhPlus": "舊",
      "zhMinus": "新",
      "plusLine": "Traditions, rituals and the way a home should run feel like home to you.",
      "minusLine": "You write your own script for love, home and holidays.",
      "h": {
        "plusLine": "Traditions and familiar rituals give your relationships and your home their shape.",
        "minusLine": "You shape love, home and celebrations in your own way rather than following a script.",
        "plusKnow": "Your rituals tell people they belong. The same song at birthdays, the same seat at dinner.",
        "minusKnow": "You shape life your own way. The usual script stays only when it fits.",
        "flexKnow": "You keep the traditions that matter and gently let the rest go.",
        "sheet": {
          "plus": {
            "light": "You hold on to a few traditions that mean something to you.",
            "clear": "Rituals matter to you. You keep birthdays and holidays feeling special.",
            "strong": "You keep the traditions alive. Without you, some would quietly fade."
          },
          "minus": {
            "light": "You follow the usual way until it stops fitting, then you make it your own.",
            "clear": "You'd rather shape love, home and holidays yourself than inherit a script.",
            "strong": "Your life is built your way. The usual script has very little pull on you."
          },
          "both": "You keep the traditions that still mean something and let the rest go."
        }
      },
      "topic": "Traditions: carry on or start new",
      "plusKnow": "Rituals are how you tell people they belong. Same song at birthdays, same seat at dinner.",
      "minusKnow": "How it's always been done is a suggestion to you. Your home, holidays and love life are custom builds.",
      "flexKnow": "You keep the traditions that still mean something and quietly retire the rest.",
      "plusKeyword": "Keeps traditions alive",
      "minusKeyword": "One of a kind",
      "sheet": {
        "plus": {
          "light": "You keep a few traditions and quietly skip the rest.",
          "clear": "Birthdays, holidays, the usual table: you keep the rituals running.",
          "strong": "Without you, the family traditions would quietly die. You won't let them."
        },
        "minus": {
          "light": "You follow the usual script until it stops fitting, then you edit it.",
          "clear": "Love, home, holidays: you'd rather design it than inherit it.",
          "strong": "How it's always been done has zero pull on you. You build your own."
        },
        "both": "You keep the traditions that earn their place and scrap the ones that don't."
      }
    },
    {
      "id": "L1",
      "plus": "Steady",
      "minus": "Venture",
      "zhPlus": "穩",
      "zhMinus": "闖",
      "plusLine": "Security first. Your leaps come with a safety net.",
      "minusLine": "New city, new plan, new try. The unknown pulls you in.",
      "h": {
        "plusLine": "You value security, and you take chances once your footing is solid.",
        "minusLine": "You're drawn to the unfamiliar, and new places and plans feel inviting to you.",
        "plusKnow": "Your big steps rest on quiet preparation. People rarely see it, so they call it luck.",
        "minusKnow": "A fully mapped plan leaves you restless. You'd rather find out as you go.",
        "flexKnow": "You can feel which season you're in. Some call for certainty, some for the unknown.",
        "sheet": {
          "plus": {
            "light": "You enjoy something new, as long as there's solid ground to return to.",
            "clear": "You'd rather return to a place you love than take a chance on a new one.",
            "strong": "You know what works for you and you keep it close. Familiar feels like home."
          },
          "minus": {
            "light": "Given a free weekend, you'll usually try at least one new thing.",
            "clear": "You'd rather discover a new place than return to your favorite.",
            "strong": "The unknown pulls at you. You'd rather find out than know in advance."
          },
          "both": "Some seasons call you home, some call you out. You feel which is which."
        }
      },
      "topic": "Favorites or new things",